株式会社極洋,"極洋","KYOKUYO CO., LTD.",https://www.kyokuyo.co.jp/
フューチャー株式会社,"フューチャー (企業)","Future Corporation",https://www.future.co.jp/
株式会社CAC Holdings,"CAC Holdings","CAC Holdings Corporation",https://www.cac-holdings.com/index.php
SBテクノロジー株式会社,"SBテクノロジー","SB TECHNOLOGY CORP.",https://www.softbanktech.co.jp/
株式会社ユー・エス・エス,"ユー・エス・エス","USS Co., Ltd.",https://www.ussnet.co.jp/
株式会社オービックビジネスコンサルタント,"オービックビジネスコンサルタント","Obic Business Consultants Co.,Ltd.",https://www.obc.co.jp/
伊藤忠テクノソリューションズ株式会社,"伊藤忠テクノソリューションズ","ITOCHU Techno-Solutions Corporation",https://www.ctc-g.co.jp/
株式会社アイティフォー,"アイティフォー","ITFOR Inc.",https://www.itfor.co.jp/
株式会社東京個別指導学院,"東京個別指導学院","Tokyo Individualized Educational Institute, INC.",https://www.kobetsu.co.jp/
モーニングスター株式会社,"モーニングスター (企業)","Morningstar Japan K.K.",https://www.morningstar.co.jp/
株式会社テー・オー・ダブリュー,"テー・オー・ダブリュー","TOW co,.ltd.",https://tow.co.jp/
株式会社大塚商会,"大塚商会","OTSUKA CORPORATION",https://www.otsuka-shokai.co.jp/
サイボウズ株式会社,"サイボウズ","Cybozu, Inc.",https://cybozu.co.jp/
セントラルスポーツ株式会社,"セントラルスポーツ","Central Sports Co., Ltd.",https://www.central.co.jp/
パラカ株式会社,"パラカ","Paraca Inc.",https://www.paraca.co.jp/
株式会社電通国際情報サービス,"電通国際情報サービス","Information Services International-Dentsu, Ltd.",https://www.isid.co.jp/
株式会社ACCESS,"ACCESS (企業)","ACCESS CO., LTD.",https://www.access-company.com/
株式会社デジタルガレージ,"デジタルガレージ","Digital Garage, Inc.",https://www.garage.co.jp/ja/
株式会社ウェザーニューズ,"ウェザーニューズ","WEATHERNEWS INC.",https://weathernews.com/
ビジネスエンジニアリング株式会社,"ビジネスエンジニアリング","Business Engineering Corporation",https://www.b-en-g.co.jp/
株式会社WOWOW,"WOWOW","WOWOW INC.",https://corporate.wowow.co.jp/
株式会社スカラ,"スカラ (テクノロジー企業)","Scala, Inc.",https://scalagrp.jp/
株式会社インテリジェント ウェイブ,"インテリジェント ウェイブ","Intelligent Wave Inc.",https://www.iwi.co.jp/
株式会社フルキャストホールディングス,"フルキャストホールディングス","FULLCAST HOLDINGS CO., LTD.",https://www.fullcastholdings.co.jp/
あすか製薬ホールディングス株式会社,"あすか製薬","ASKA Pharmaceutical Holdings Co., Ltd.",https://www.aska-pharma-hd.co.jp/
富士フイルムホールディングス株式会社,"富士フイルムホールディングス","FUJIFILM Holdings Corporation",https://holdings.fujifilm.com/ja
コニカミノルタ株式会社,"コニカミノルタ","KONICA MINOLTA, INC.",https://www.konicaminolta.com/jp-ja/index.html
株式会社資生堂,"資生堂","Shiseido Company, Limited",https://www.shiseidogroup.jp/
ライオン株式会社,"ライオン (企業)","Lion Corporation",https://www.lion.co.jp/ja/
高砂香料工業株式会社,"高砂香料工業","TAKASAGO INTERNATIONAL CORPORATION",https://www.takasago.com/ja
株式会社ファンケル,"ファンケル","FANCL CORPORATION",https://www.fancl.co.jp/index.html
株式会社ポーラ・オルビスホールディングス,"ポーラ (企業)","POLA ORBIS HOLDINGS INC.",https://www.po-holdings.co.jp/
新日本製薬株式会社,"新日本製薬","Shinnihonseiyaku Co., Ltd.",https://corporate.shinnihonseiyaku.co.jp/
エステー株式会社,"エステー","S. T. Corporation",https://www.st-c.co.jp/
アグロ カネショウ株式会社,"アグロ カネショウ","Agro-Kanesho Co., Ltd.",https://www.agrokanesho.co.jp/
コニシ株式会社,"コニシ","Konishi Company, Limited",http://www.bond.co.jp/
長谷川香料株式会社,"長谷川香料","T. HASEGAWA CO., LTD.",https://www.t-hasegawa.co.jp/index.php
星光PMC株式会社,"星光PMC","SEIKO PMC CORPORATION",https://www.seikopmc.co.jp/
小林製薬株式会社,"小林製薬","Kobayashi Pharmaceutical Co., Ltd.",https://www.kobayashi.co.jp/
荒川化学工業株式会社,"荒川化学工業","ARAKAWA CHEMICAL INDUSTRIES, LTD.",https://www.arakawachem.co.jp/
メック株式会社,"メック (化学メーカー)","MEC COMPANY LTD.",https://www.mec-co.com/
日本高純度化学株式会社,"日本高純度化学","JAPAN PURE CHEMICAL CO.,LTD.",https://www.netjpc.com/
株式会社JCU,"JCU (化学メーカー)","JCU CORPORATION",https://www.jcu-i.com/
デクセリアルズ株式会社,"デクセリアルズ","Dexerials Corporation",https://www.dexerials.jp/
アース製薬株式会社,"アース製薬","Earth Corporation",https://corp.earth.jp/jp/
クミアイ化学工業株式会社,"クミアイ化学工業","KUMIAI CHEMICAL INDUSTRY CO.,LTD.",https://www.kumiai-chem.co.jp/
日本農薬株式会社,"日本農薬","Nihon Nohyaku Co., Ltd.",https://www.nichino.co.jp/
富士石油株式会社,"富士石油","Fuji Oil Company, Ltd.",http://www.foc.co.jp/
出光興産株式会社,"出光興産","Idemitsu Kosan Co.,Ltd.",https://www.idemitsu.com/jp/
コスモエネルギーホールディングス株式会社,"コスモエネルギーホールディングス","COSMO ENERGY HOLDINGS CO., LTD.",https://ceh.cosmo-oil.co.jp/
インフロニア・ホールディングス株式会社,"インフロニア・ホールディングス","INFRONEER Holdings Inc.",https://www.infroneer.com/
横浜ゴム株式会社,"横浜ゴム","The Yokohama Rubber Co., Ltd.",https://www.y-yokohama.com/
TOYO TIRE株式会社,"TOYO TIRE","Toyo Tire Corporation",https://www.toyotires.co.jp/
株式会社ブリヂストン,"ブリヂストン","Bridgestone Corporation",https://www.bridgestone.co.jp/
住友ゴム工業株式会社,"住友ゴム工業","Sumitomo Rubber Industries, Ltd.",https://www.srigroup.co.jp/
藤倉コンポジット株式会社,"藤倉コンポジット","FUJIKURA COMPOSITES Inc.",https://www.fujikuracomposites.jp/
オカモト株式会社,"オカモト","Okamoto Industries, Incorporated",https://www.okamoto-inc.jp/
株式会社WOW WORLD GROUP,"WOW WORLD","WOW WORLD GROUP Inc.",https://www.wow-world-group.co.jp/
アキレス株式会社,"アキレス (化学工業)","Achilles Corporation",https://www.achilles.jp/
ニッタ株式会社,"ニッタ","Nitta Corporation",https://www.nitta.co.jp/
住友理工株式会社,"住友理工","Sumitomo Riko Company Limited",https://www.sumitomoriko.co.jp/
バンドー化学株式会社,"バンドー化学","Bando Chemical Industries, Ltd.",https://www.bandogrp.com/
AGC株式会社,"AGC","AGC Inc.",https://www.agc.com/
日本電気硝子株式会社,"日本電気硝子","Nippon Electric Glass Co., Ltd.",https://www.neg.co.jp/
住友大阪セメント株式会社,"住友大阪セメント","Sumitomo Osaka Cement Company, Limited",https://www.soc.co.jp/
太平洋セメント株式会社,"太平洋セメント","Taiheiyo Cement Corporation",https://www.taiheiyo-cement.co.jp/
リソルホールディングス株式会社,"リソルホールディングス","RESOL HOLDINGS Co., Ltd.",https://www.resol.jp/
日本ヒューム株式会社,"日本ヒューム","NIPPON HUME CORPORATION",http://www.nipponhume.co.jp/
日本コンクリート工業株式会社,"日本コンクリート工業","NIPPON CONCRETE INDUSTRIES CO.,LTD.",https://www.ncic.co.jp/
東海カーボン株式会社,"東海カーボン","TOKAI CARBON CO., LTD.",https://www.tokaicarbon.co.jp/
日本カーボン株式会社,"日本カーボン","Nippon Carbon Co., Ltd.",https://www.carbon.co.jp/
東洋炭素株式会社,"東洋炭素","TOYO TANSO CO., LTD.",https://www.toyotanso.co.jp/
株式会社ノリタケカンパニーリミテド,"ノリタケカンパニーリミテド","Noritake Company, Limited",https://www.noritake.co.jp/
TOTO株式会社,"TOTO (企業)","TOTO LTD.",https://jp.toto.com/
日本特殊陶業株式会社,"日本特殊陶業","NGK SPARK PLUG CO., LTD.",https://www.ngkntk.co.jp/
品川リフラクトリーズ株式会社,"品川リフラクトリーズ","SHINAGAWA REFRACTORIES CO.,LTD.",https://www.shinagawa.co.jp/
株式会社ヨータイ,"ヨータイ","YOTAI REFRACTORIES CO.,LTD.",https://www.yotai.co.jp/
ニチアス株式会社,"ニチアス","NICHIAS Corporation",https://www.nichias.co.jp/
日本製鉄株式会社,"日本製鉄","NIPPON STEEL CORPORATION",https://www.nipponsteel.com/
合同製鐵株式会社,"合同製鐵","GODO STEEL, Ltd.",https://www.godo-steel.co.jp/
JFEホールディングス株式会社,"JFEホールディングス","JFE Holdings, Inc.",https://www.jfe-holdings.co.jp/
東京製鐵株式会社,"東京製鐵","TOKYO STEEL MANUFACTURING CO., Ltd.",http://www.tokyosteel.co.jp/
共英製鋼株式会社,"共英製鋼","KYOEI STEEL LTD.",https://www.kyoeisteel.co.jp/ja/index.html
株式会社淀川製鋼所,"淀川製鋼所","Yodogawa Steel Works, Ltd.",https://www.yodoko.co.jp/
丸一鋼管株式会社,"丸一鋼管","MARUICHI STEEL TUBE LTD.",https://www.maruichikokan.co.jp/
大同特殊鋼株式会社,"大同特殊鋼","Daido Steel Co., Ltd.",https://www.daido.co.jp/
日本冶金工業株式会社,"日本冶金工業","Nippon Yakin Kogyo Co., Ltd.",https://www.nyk.co.jp/
山陽特殊製鋼株式会社,"山陽特殊製鋼","Sanyo Special Steel Co., Ltd.",http://www.sanyo-steel.co.jp/
日立金属株式会社,"日立金属","Hitachi Metals, Ltd.",https://www.hitachi-metals.co.jp/
日本金属株式会社,"日本金属","NIPPON KINZOKU CO., LTD.",https://www.nipponkinzoku.co.jp/
大平洋金属株式会社,"大平洋金属","Pacific Metals Co., Ltd.",https://www.pacific-metals.co.jp/
新日本電工株式会社,"新日本電工","Nippon Denko Co., Ltd.",http://www.nippondenko.co.jp/
株式会社日本製鋼所,"日本製鋼所","THE JAPAN STEEL WORKS, LTD.",https://www.jsw.co.jp/
日本精線株式会社,"日本精線","Nippon Seisen Co., Ltd.",https://www.n-seisen.co.jp/
株式会社エンビプロ・ホールディングス,"エンビプロ・ホールディングス","ENVIPRO HOLDINGS Inc.",https://www.envipro.jp/
三井金属鉱業株式会社,"三井金属鉱業","Mitsui Mining & Smelting Co., Ltd.",https://www.mitsui-kinzoku.com/
三菱マテリアル株式会社,"三菱マテリアル","Mitsubishi Materials Corporation",https://www.mmc.co.jp/corporate/ja/
住友金属鉱山株式会社,"住友金属鉱山","Sumitomo Metal Mining Co., Ltd.",https://www.smm.co.jp/
DOWAホールディングス株式会社,"DOWAホールディングス","DOWA Holdings Co., Ltd.",https://www.dowa.co.jp/
古河機械金属株式会社,"古河機械金属","FURUKAWA CO.,LTD.",https://www.furukawakk.co.jp/
株式会社大阪チタニウムテクノロジーズ,"大阪チタニウムテクノロジーズ","OSAKA Titanium technologies Co.,Ltd.",https://www.osaka-ti.co.jp/
東邦チタニウム株式会社,"東邦チタニウム","TOHO TITANIUM COMPANY, LIMITED",https://www.toho-titanium.co.jp/
株式会社UACJ,"UACJ","UACJ Corporation",https://www.uacj.co.jp/
古河電気工業株式会社,"古河電気工業","Furukawa Electric Co., Ltd.",https://www.furukawa.co.jp/
住友電気工業株式会社,"住友電気工業","Sumitomo Electric Industries, Ltd.",https://sumitomoelectric.com/jp
タツタ電線株式会社,"タツタ電線","Tatsuta Electric Wire Cable Co,.LTD",http://www.tatsuta.co.jp/
平河ヒューテック株式会社,"平河ヒューテック","HIRAKAWA HEWTECH CORP.",https://www.hewtech.co.jp/
株式会社いよぎんホールディングス,"いよぎんホールディングス","Iyogin Holdings,Inc.",https://www.iyogin-hd.co.jp/
株式会社しずおかフィナンシャルグループ,"しずおかフィナンシャルグループ","Shizuoka Financial Group, Inc.",https://www.shizuoka-fg.co.jp/
株式会社ちゅうぎんフィナンシャルグループ,"ちゅうぎんフィナンシャルグループ","Chugin Financial Group,Inc.",https://www.chugin-fg.co.jp/
東洋製罐グループホールディングス株式会社,"東洋製罐グループホールディングス","Toyo Seikan Group Holdings,Ltd.",https://www.tskg-hd.com/
ホッカンホールディングス株式会社,"ホッカンホールディングス","HOKKAN HOLDINGS LIMITED",http://www.hokkanholdings.co.jp/
株式会社横河ブリッジ,"横河ブリッジ","Yokogawa Bridge Corp.",http://www.yokogawa-bridge.co.jp/
株式会社駒井ハルテック　,"駒井ハルテック","KOMAIHALTEC Inc.",https://www.komaihaltec.co.jp/
三和ホールディングス株式会社,"三和シヤッター工業","Sanwa Holdings Corporation",https://www.sanwa-hldgs.co.jp/
文化シヤッター株式会社,"文化シヤッター","Bunka Shutter Co., Ltd.",https://www.bunka-s.co.jp/
三協立山株式会社,"三協立山","Sankyo Tateyama,Inc.",https://www.st-grp.co.jp/
株式会社ノーリツ,"ノーリツ","NORITZ CORPORATION",https://www.noritz.co.jp/
株式会社長府製作所,"長府製作所","CHOFU SEISAKUSHO Co.,Ltd.",https://www.chofu.co.jp/
ユニプレス株式会社,"ユニプレス","Unipres Corporation",https://www.unipres.co.jp/
岡部株式会社,"岡部 (金属加工)","OKABE CO., LTD.",https://www.okabe.co.jp/
東プレ株式会社,"東プレ","Topre Corporation",https://www.topre.co.jp/
高周波熱錬株式会社,"高周波熱錬","Neturen Co., Ltd.",https://www.k-neturen.co.jp/
東京製綱株式会社,"東京製綱","Tokyo Rope Mfg. Co., Ltd.",https://www.tokyorope.co.jp/
サンコール株式会社,"サンコール","SUNCALL CORPORATION",https://www.suncall.co.jp/
日本発條株式会社,"日本発条","NHK SPRING CO.,LTD.",https://www.nhkspg.co.jp/
三浦工業株式会社,"三浦工業","MIURA CO.,LTD.",https://www.miuraz.co.jp/
株式会社タクマ,"タクマ (企業)","Takuma Co.,Ltd",https://www.takuma.co.jp/
テクノプロ・ホールディングス株式会社,"テクノプロ・ホールディングス","TechnoPro Holdings,Inc.",https://www.technoproholdings.com/
株式会社アイ・アール ジャパンホールディングス,"アイ・アール ジャパンホールディングス","IR Japan Holdings, Ltd.",https://www.irjapan.jp/
KeePer技研株式会社,"KeePer技研","KeePer Technical Laboratory Co.ltd",https://keepergiken.co.jp/
イー・ガーディアン株式会社,"イー・ガーディアン","E-Guardian Inc.",https://www.e-guardian.co.jp/
株式会社リブセンス,"リブセンス","Livesense Inc.",https://www.livesense.co.jp/
ジャパンマテリアル株式会社,"ジャパンマテリアル","JAPAN MATERIAL Co.,Ltd.",http://www.j-material.jp/
株式会社ベクトル,"ベクトル (PR会社)","Vector Inc.",https://vectorinc.co.jp/
株式会社チャーム・ケア・コーポレーション,"チャーム・ケア・コーポレーション","CHARM CARE CORPORATION",http://www.charmcc.jp/
株式会社IBJ,"IBJ","IBJ,Inc.",https://www.ibjapan.jp/
株式会社アサンテ,"アサンテ","ASANTE INCORPORATED",https://www.asante.co.jp/
M&Aキャピタルパートナーズ株式会社,"M&Aキャピタルパートナーズ","M&A Capital Partners Co.,Ltd.",https://www.ma-cp.com/
株式会社ライドオンエクスプレスホールディングス,"ライドオンエクスプレスホールディングス","RIDE ON EXPRESS HOLDINGS Co.,Ltd.",https://www.rideonexpresshd.co.jp/
株式会社ウィルグループ,"ウィルグループ","WILL GROUP,INC.",https://willgroup.co.jp/
エスクロー・エージェント・ジャパン,"エスクロー・エージェント・ジャパン","Escrow Agent Japan,Inc.",https://www.ea-j.jp/
メドピア株式会社,"メドピア","MedPeer,Inc.",https://medpeer.co.jp/
株式会社レアジョブ,"レアジョブ","RareJob Inc.",https://www.rarejob.co.jp/
株式会社リクルートホールディングス,"リクルートホールディングス","Recruit Holdings Co., Ltd.",https://recruit-holdings.com/ja/
株式会社ツガミ,"ツガミ","Tsugami Corporation",https://www.tsugami.co.jp/
オークマ株式会社,"オークマ","Okuma Corporation",https://www.okuma.co.jp/
株式会社アマダ,"アマダ","AMADA CO.,LTD.",https://www.amada.co.jp/ja
アイダエンジニアリング株式会社,"アイダエンジニアリング","AIDA ENGINEERING, LTD.",https://www.aida.co.jp/index.html
株式会社FUJI,"FUJI (企業)","FUJI CORPORATION",https://www.fuji.co.jp/
株式会社牧野フライス製作所,"牧野フライス製作所","Makino Milling Machine Co., Ltd.",https://www.makino.co.jp/
オーエスジー株式会社,"オーエスジー","OSG CORPORATION",https://www.osg.co.jp/
旭ダイヤモンド工業株式会社,"旭ダイヤモンド工業","Asahi Diamond Industrial Co.,Ltd.",https://www.asahidia.co.jp/
DMG森精機株式会社,"DMG森精機","DMG MORI Co.,Ltd.",https://www.dmgmori.co.jp/
日東工器株式会社,"日東工器","NITTO KOHKI CO.,LTD.",https://www.nitto-kohki.co.jp/
日進工具株式会社,"日進工具","NS TOOL CO.,LTD.",https://www.ns-tool.com/
パンチ工業株式会社,"パンチ工業","PUNCH INDUSTRY CO., LTD.",http://www.punch.co.jp/
株式会社ベルシステム24ホールディングス,"ベルシステム24","BELLSYSTEM24 HOLDINGS,INC.",https://www.bell24.co.jp/ja/
株式会社鎌倉新書,"鎌倉新書","Kamakura Shinsho, Ltd.",https://www.kamakura-net.co.jp/
SMN株式会社,"SMN","SMN Corporation",https://www.so-netmedia.jp/
株式会社エアトリ,"エアトリ","AirTrip Corp.",https://www.airtrip.co.jp/
株式会社アトラエ,"アトラエ","Atrae,Inc.",https://atrae.co.jp/
株式会社ストライク,"ストライク (企業)","Strike Company,Limited",https://www.strike.co.jp/
株式会社ソラスト,"ソラスト","Solasto Corporation",https://www.solasto.co.jp/
株式会社セラク,"セラク","SERAKU Co., Ltd.",https://www.seraku.co.jp/
株式会社インソース,"インソース","Insource Co., Ltd.",https://www.insource.co.jp/
株式会社豊田自動織機,"豊田自動織機","Toyota Industries Corporation",https://www.toyota-shokki.co.jp/
豊和工業株式会社,"豊和工業","Howa Machinery, Ltd.",http://www.howa.co.jp/
エンシュウ株式会社,"エンシュウ","ENSHU Limited",https://www.enshu.co.jp/
株式会社日阪製作所,"日阪製作所","HISAKA WORKS, LTD.",https://www.hisaka.co.jp/
株式会社やまびこ,"やまびこ (企業)","Yamabiko Corporation",http://www.yamabiko-corp.co.jp/
平田機工株式会社,"平田機工","Hirata Corporation",https://www.hirata.co.jp/
ペガサスミシン製造株式会社,"ペガサスミシン製造","PEGASUS SEWING MACHINE MFG.CO.,LTD.",https://www.pegasus.co.jp/ja/
株式会社マルマエ,"マルマエ","Marumae Co,. Ltd.",http://www.marumae.com/
ナブテスコ株式会社,"ナブテスコ","Nabtesco Corporation",https://www.nabtesco.com/
三井海洋開発株式会社,"三井海洋開発","MODEC, INC.",https://www.modec.com/jp/index.html
SMC株式会社,"SMC","SMC Corporation",https://www.smcworld.com/ja-jp/
ホソカワミクロン株式会社,"ホソカワミクロン","Hosokawa Micron Corporation",https://www.hosokawamicron.co.jp/jp/global.html
オイレス工業株式会社,"オイレス工業","OILES CORPORATION",http://www.oiles.co.jp/
日精エー・エス・ビー機械株式会社,"日精エー・エス・ビー機械","NISSEI ASB MACHINE CO., LTD.",http://www.nisseiasb.co.jp/
サトーホールディングス株式会社,"サトーホールディングス","SATO HOLDINGS CORPORATION.",http://www.sato.co.jp/
オカダアイヨン株式会社,"オカダアイヨン","Okada Aiyon Corporation",https://www.aiyon.co.jp/
株式会社小松製作所,"小松製作所","Komatsu Ltd.",https://www.komatsu.jp/ja
住友重機械工業株式会社,"住友重機械工業","SUMITOMO HEAVY INDUSTRIES, LTD.",https://www.shi.co.jp/
日立建機株式会社,"日立建機","Hitachi Construction Machinery Co., Ltd.",https://www.hitachicm.com/global/jp/
日工株式会社,"日工","NIKKO CO., LTD.",https://www.nikko-net.co.jp/
井関農機株式会社,"井関農機","ISEKI & CO., LTD.",https://www.iseki.co.jp/
株式会社北川鉄工所,"北川鉄工所","Kitagawa Corporation",https://www.kiw.co.jp/
株式会社クボタ,"クボタ","Kubota Corporation",https://www.kubota.co.jp/
荏原実業株式会社,"荏原実業","Ebara Jitsugyo Co., Ltd.",https://www.ejk.co.jp/
三菱化工機株式会社,"三菱化工機","Mitsubishi Kakoki Kaisha,Ltd.",http://www.kakoki.co.jp/
月島機械株式会社,"月島機械","TSUKISHIMA KIKAI CO.,LTD.",https://www.tsk-g.co.jp/
株式会社帝国電機製作所,"帝国電機製作所","TEIKOKU ELECTRIC MFG.CO.,LTD.",https://www.teikokudenki.co.jp/
新東工業株式会社,"新東工業","SINTOKOGIO, LTD.",https://www.sinto.co.jp/
澁谷工業株式会社,"澁谷工業","Shibuya Corporation",https://www.shibuya.co.jp/
株式会社アイチコーポレーション,"アイチコーポレーション","AICHI CORPORATION",https://www.aichi-corp.co.jp/
株式会社鶴見製作所,"鶴見製作所","TSURUMI MANUFACTURING CO.,LTD.",https://www.tsurumipump.co.jp/
酒井重工業株式会社,"酒井重工業","SAKAI HEAVY INDUSTRIES, LTD.",https://www.sakainet.co.jp/
株式会社荏原製作所,"荏原製作所","Ebara Corporation",https://www.ebara.co.jp/
株式会社酉島製作所,"酉島製作所","TORISHIMA PUMP MFG. CO.,LTD.",https://www.torishima.co.jp/
ダイキン工業株式会社,"ダイキン工業","Daikin Industries, Ltd.",https://www.daikin.co.jp/
オルガノ株式会社,"オルガノ","ORGANO CORPORATION",https://www.organo.co.jp/
トーヨーカネツ株式会社,"トーヨーカネツ","TOYO KANETSU K.K.",https://www.toyokanetsu.co.jp/
栗田工業株式会社,"栗田工業","Kurita Water Industries Ltd.",https://www.kurita.co.jp/
株式会社椿本チエイン,"椿本チエイン","Tsubakimoto Chain Co.",https://www.tsubakimoto.jp/
日機装株式会社,"日機装","NIKKISO CO., LTD.",https://www.nikkiso.co.jp/
レイズネクスト株式会社,"レイズネクスト","RAIZNEXT Corporation",https://www.raiznext.co.jp/
アネスト岩田株式会社,"アネスト岩田","ANEST IWATA Corporation",https://www.anest-iwata.co.jp/
株式会社ダイフク,"ダイフク","Daifuku Co., Ltd.",https://www.daifuku.com/jp/
サムコ株式会社,"サムコ","SAMCO Inc.",https://www.samco.co.jp/
株式会社タダノ,"タダノ","TADANO LTD.",https://www.tadano.co.jp/
フジテック株式会社,"フジテック","FUJITEC CO., LTD.",https://www.fujitec.co.jp/
理想科学工業株式会社,"理想科学工業","RISO KAGAKU CORPORATION",https://www.riso.co.jp/
日本金銭機械株式会社,"日本金銭機械","Japan Cash Machine Co., Ltd.",http://www.jcm-hq.co.jp/
株式会社マースグループホールディングス,"マースグループホールディングス","Mars Group Holdings Corporation,",http://www.mars-ghd.co.jp/
フクシマガリレイ株式会社,"フクシマガリレイ","FUKUSHIMA GALILEI CO.LTD.",https://www.galilei.co.jp/
株式会社オーイズミ,"オーイズミ","OIZUMI Corporation",https://www.oizumi.co.jp/
ダイコク電機株式会社,"ダイコク電機","Daikoku Denki Co., Ltd.",http://www.daxel.co.jp/
株式会社竹内製作所,"竹内製作所","TAKEUCHI MFG.CO.,LTD.",https://www.takeuchi-mfg.co.jp/
アマノ株式会社,"アマノ","Amano Corporation",https://www.amano.co.jp/
株式会社ジャノメ,"ジャノメ","JANOME Corporation",https://www.janome.co.jp/
ブラザー工業株式会社,"ブラザー工業","BROTHER INDUSTRIES, LTD.",https://www.brother.co.jp/
マックス株式会社,"マックス (機械メーカー)","MAX Co., Ltd.",https://www.max-ltd.co.jp/
株式会社モリタホールディングス,"モリタホールディングス","MORITA HOLDINGS CORPORATION",https://www.morita119.com/
グローリー株式会社,"グローリー (企業)","GLORY LTD.",https://www.glory.co.jp/
新晃工業株式会社,"新晃工業","SINKO INDUSTRIES LTD.",https://www.sinko.co.jp/
セガサミーホールディングス株式会社,"セガサミーホールディングス","SEGA SAMMY HOLDINGS INC.",https://www.segasammy.co.jp/
株式会社リケン,"リケン","RIKEN CORPORATION",https://www.riken.co.jp/
TPR株式会社,"TPR","TPR Co., Ltd.",https://www.tpr.co.jp/
ホシザキ株式会社,"ホシザキ","HOSHIZAKI CORPORATION",https://www.hoshizaki.co.jp/
日本精工株式会社,"日本精工","NSK Ltd.",https://www.nsk.com/jp/
株式会社ジェイテクト,"ジェイテクト","JTEKT Corporation",https://www.jtekt.co.jp/
株式会社不二越,"不二越","NACHI-FUJIKOSHI CORP.",https://www.nachi-fujikoshi.co.jp/
日本トムソン株式会社,"日本トムソン","NIPPON THOMPSON CO.,LTD.",https://www.ikont.co.jp/
THK株式会社,"THK (機械メーカー)","THK CO., LTD.",https://www.thk.com/?q=jp
前澤給装工業株式会社,"前澤給装工業","Maezawa Kyuso Industries Co., Ltd.",http://www.qso.co.jp/
イーグル工業株式会社,"イーグル工業","Eagle Industry Co., Ltd.",https://www.ekkeagle.com/jp/
日本ピラー工業株式会社,"日本ピラー工業","NIPPON PILLAR PACKING CO.,LTD.",https://www.pillar.co.jp/
株式会社日立製作所,"日立製作所","Hitachi, Ltd.",https://www.hitachi.co.jp/
株式会社東芝,"東芝","TOSHIBA CORPORATION",https://www.global.toshiba/jp/top.html
三菱電機株式会社,"三菱電機","MITSUBISHI ELECTRIC Corporation",https://www.mitsubishielectric.co.jp/
株式会社安川電機,"安川電機","YASKAWA Electric Corporation",https://www.yaskawa.co.jp/
