株式会社極洋,"極洋","KYOKUYO CO., LTD.",https://www.kyokuyo.co.jp/
株式会社デザインワン・ジャパン,"デザインワン・ジャパン","DesignOne Japan, Inc",https://www.designone.jp/
株式会社ウチヤマホールディングス,"ウチヤマホールディングス","UCHIYAMA HOLDINGS Co.,Ltd.",http://www.uchiyama-gr.jp/
株式会社ジェイエスエス,"ジェイエスエス","JSS Corporation",https://www.jss-group.co.jp/
ERIホールディングス株式会社,"ERIホールディングス","ERI HOLDINGS CO.,LTD.",https://www.h-eri.co.jp/
浜井産業株式会社,"浜井産業","HAMAI CO.,LTD",http://www.hamai.com/
ダイジット工業株式会社DIJET INDUSTRIAL CO., LTD.,"ダイジェット工業","ヱ",https://www.dijet.co.jp/
西部電機株式会社,"西部電機","Seibu Electric & Machinery Co., Ltd.",https://www.seibudenki.co.jp/
高松機械工業株式会社,"高松機械工業","Takamatsu Machinery Co., Ltd.",https://www.takamaz.co.jp/
株式会社エーワン精密,"エーワン精密","A-One Seimitsu Inc.",http://www.a-one-seimitsu.co.jp/
ミクロン精密株式会社,"ミクロン精密","MICRON MACHINERY CO.,LTD.",http://www.micron-grinder.co.jp/
株式会社太陽工機,"太陽工機","Taiyo Koki Co., Ltd.",http://www.taiyokoki.com/
富士ソフトサービスビューロ株式会社,"富士ソフトサービスビューロ","FUJI SOFT SERVICE BUREAU INCORPORATED",https://www.fsisb.co.jp/
ニデックオーケーケー株式会社,"ニデックオーケーケー","NIDEC OKK CORPORATION",https://www.nidec.com/jp/nidec-okk/
津田駒工業株式会社,"津田駒工業","Tsudakoma Corp.",https://www.tsudakoma.co.jp/
守谷輸送機工業株式会社,"守谷輸送機工業","Moriya Transportation Engineering and Manufacturing Co.,Ltd.",https://moriya-elevator.co.jp/
SANEI株式会社,"SANEI","SANEI LTD.",https://www.sanei.ltd/
株式会社ナガオカ,"ナガオカ (大阪府)","NAGAOKA INTERNATIONAL CORPORATION",https://www.nagaokajapan.co.jp/
日本ゲームカード株式会社,"日本ゲームカード","Nippon Game Card Corporation",https://www.gamecard.co.jp/
株式会社藤商事,"藤商事","FUJISHOJI CO., LTD.",https://www.fujimarukun.co.jp/
コンバム株式会社,"コンバム","CONVUM LTD.",https://convum.co.jp/
ゼネラルパッカー株式会社,"ゼネラルパッカー","General Packer Co., Ltd.",https://www.general-packer.co.jp/
株式会社カワタ,"カワタ","KAWATA MFG. CO.,LTD.",https://www.kawata.cc/
サンセイ株式会社,"サンセイ","SANSEI CO.,LTD.",https://sansei-group.co.jp/
株式会社丸山製作所,"丸山製作所","MARUYAMA MFG. CO., INC.",http://www.maruyama.co.jp/
明治機械株式会社,"明治機械","Meiji Machine Co., Ltd.",https://www.meiji-kikai.co.jp/
株式会社東京機械製作所,"東京機械製作所","Tokyo Kikai Seisaksho, Ltd.",https://www.tks-net.co.jp/
株式会社テセック,"テセック","TESEC Corporation",http://www.tesec.co.jp/
株式会社タカトリ,"タカトリ","Takatori Corporation",http://www.takatori-g.co.jp/
住友精密工業株式会社,"住友精密工業","Sumitomo Precision Products Co., Ltd.",https://www.spp.co.jp/
日本ギア工業株式会社,"日本ギア工業","NIPPON GEAR CO.,LTD.",http://www.nippon-gear.jp/
三精テクノロジーズ株式会社,"三精テクノロジーズ","Sansei Technologies, Inc.",https://www.sansei-technologies.com/
株式会社電業社機械製作所,"電業社機械製作所","DMW CORPORATION",http://www.dmw.co.jp/
千代田化工建設株式会社,"千代田化工建設","CHIYODA Corporation",https://www.chiyodacorp.com/
大同工業株式会社,"大同工業","Daido Kogyo Co., Ltd.",https://www.did-daido.co.jp/
木村化工機株式会社,"木村化工機","KIMURA CHEMICAL PLANTS CO.,LTD.",https://www.kcpc.co.jp/
トリニティ工業株式会社,"トリニティ工業","Trinity Industrial Corporation",http://www.trinityind.co.jp/
株式会社ヤマダコーポレーション,"ヤマダコーポレーション","YAMADA CORPORATION",https://yamadacorp.co.jp/
株式会社宇野澤組鐵工所,"宇野澤組鐵工所","Unozawa-gumi Iron Works,Limited",https://www.unozawa.co.jp/
鈴茂器工株式会社,"鈴茂器工","Suzumo Machinery Co.,LTD",https://www.suzumo.co.jp/
株式会社高見沢サイバネティックス,"高見沢サイバネティックス","Takamisawa Cybernetics Co., Ltd.",https://www.tacy.co.jp/
株式会社ユニバーサルエンターテインメント,"ユニバーサルエンターテインメント","UNIVERSAL ENTERTAINMENT CORPORATION",https://www.universal-777.com/
ヒーハイスト株式会社,"ヒーハイスト","Hephaist Co., Ltd.",http://www.hephaist.co.jp/
株式会社TVE,"TVE (企業)","TVE Co.,Ltd.",https://www.toavalve.co.jp/
株式会社ヨシタケ,"ヨシタケ","Yoshitake Inc.",https://www.yoshitake.co.jp/
前澤工業株式会社,"前澤工業","Maezawa Industries, Inc.",http://www.maezawa.co.jp/
株式会社NITTAN,"NITTAN","NITTAN Corporation",https://www.niv.co.jp/
株式会社宮入バルブ製作所,"宮入バルブ製作所","Miyairi Valve Mfg. Co., Ltd.",http://www.miyairi-valve.co.jp/
東洋電機製造株式会社,"東洋電機製造","TOYO DENKI SEIZO KABUSHIKI KAISHA",https://www.toyodenki.co.jp/
株式会社オリジン,"オリジン (メーカー)","Origin Company,Limited",https://www.origin.co.jp/
株式会社FCホールディングス,"福山コンサルタント","Founder's Consultants Holdings Inc.",http://www.fchd.jp/
フルテック株式会社,"フルテック","Fulltech Co.Ltd.",https://www.fulltech1963.com/
株式会社グリーンズ,"グリーンズ","Greens Co., Ltd.",https://www.greens.co.jp/
株式会社MS&Consulting,"MS&Consulting","MS&Consulting Co., Ltd.",https://www.msandc.co.jp/
ABホテル株式会社,"ABホテル","ABHOTEL CO., LTD.",https://www.ab-hotel.jp/
株式会社共和コーポレーション,"共和コーポレーション","Kyowa Corporation",https://www.kyowa-corp.co.jp/
株式会社シキノハイテック,"シキノハイテック","Shikino High-Tech CO.,LTD.",https://www.shikino.co.jp/
JALCOホールディングス株式会社,"JALCOホールディングス","JALCO Holdings Inc.",https://www.jalco-hd.com/
株式会社テラプローブ,"テラプローブ","Tera Probe, Inc.",https://www.teraprobe.com/
テクノホライゾン株式会社,"テクノホライゾン","TECHNO HORIZON CO., LTD.",https://www.technohorizon.co.jp/
株式会社ネクスグループ,"ネクスグループ","NCXX Group Inc.",https://ncxxgroup.co.jp/
寺崎電気産業株式会社,"寺崎電気産業","TERASAKI ELECTRIC CO., LTD.",http://www.terasaki.co.jp/
森尾電機株式会社,"森尾電機","MORIO DENKI CO., LTD.",http://www.morio.co.jp/
株式会社MCJ,"MCJ","MCJ Co., Ltd.",https://www.mcj.jp/
株式会社ズーム,"ズーム (楽器メーカー)","ZOOM CORPORATION",https://zoomcorp.com/ja/jp/
株式会社ナカヨ,"ナカヨ","NAKAYO,INC.",https://www.nyc.co.jp/
株式会社アクセル,"アクセル (電気機器)","AXELL CORPORATION",https://www.axell.co.jp/
株式会社ピクセラ,"ピクセラ","PIXELA CORPORATION",http://www.pixela.co.jp/
株式会社ニューテック,"ニューテック (情報機器)","Newtech Co., Ltd.",https://www.newtech.co.jp/
サン電子株式会社,"サン電子","SUNCORPORATION",https://www.sun-denshi.co.jp/
大同信号株式会社,"大同信号","Daido Signal Co.,Ltd.",https://www.daido-signal.co.jp/
星和電機株式会社,"星和電機","SEIWA ELECTRIC MFG. CO.,LTD.",https://www.seiwa.co.jp/
株式会社OSGコーポレーション,"OSGコーポレーション","OSG Corporation Co., Ltd.",https://www.osg-nandemonet.co.jp/
ザインエレクトロニクス株式会社,"ザインエレクトロニクス","THine Electronics, Inc.",https://www.thine.co.jp/
池上通信機株式会社,"池上通信機","IKEGAMI TSUSHINKI CO.,LTD.",https://www.ikegami.co.jp/
東京コスモス電機株式会社,"東京コスモス電機","Tokyo Cosmos Electric Co.,Ltd.",https://www.tocos-j.co.jp/jp/
santec株式会社,"","SANTEC CORPORATION",https://www.santec.com/
株式会社RVH,"RVH (企業)","RVH Inc.",https://rvh.jp/
伊豆シャボテンリゾート株式会社,"伊豆シャボテンリゾート","Izu Shaboten Resort Co.,Ltd.",http://www.izu-sr.co.jp/
新コスモス電機株式会社,"新コスモス電機","New Cosmos Electric Co., Ltd.",https://www.new-cosmos.co.jp/
アライドテレシスホールディングス株式会社,"アライドテレシスホールディングス","ALLIED TELESIS HOLDINGS K.K",http://www.at-global.com/
ぷらっとホーム株式会社,"ぷらっとホーム","Plat'Home Co.,LTD",https://www.plathome.co.jp/
株式会社京写,"京写","KYOSHA CO.,LTD.",https://www.kyosha.co.jp/
株式会社多摩川ホールディングス,"多摩川ホールディングス","TAMAGAWA HOLDINGS CO.,LTD.",https://www.tmex.co.jp/
株式会社AKIBAホールディングス,"AKIBAホールディングス","AKIBA Holdings Co., Ltd.",https://www.akiba-holdings.co.jp/
東亜ディーケーケー株式会社,"東亜ディーケーケー","DKK-TOA CORPORATION",https://www.toadkk.co.jp/
日本電子材料株式会社,"日本電子材料","JAPAN ELECTRONIC MATERIALS CORPORATION",http://www.jem-net.co.jp/
株式会社小野測器,"小野測器","Ono Sokki Co., Ltd.",https://www.onosokki.co.jp/
ミナトホールディングス株式会社,"ミナトホールディングス","MINATO HOLDINGS INC.",https://www.minato.co.jp/
株式会社エヌエフホールディングス,"エヌエフ回路設計ブロック","NF HOLDINGS CORPORATION",https://www.nfhd.co.jp/jp/
株式会社フェローテックホールディングス,"フェローテックホールディングス","Ferrotec Holdings Corporation",https://www.ferrotec.co.jp/
パルステック工業株式会社,"パルステック工業","PULSTEC INDUSTRIAL CO., LTD.",https://www.pulstec.co.jp/
株式会社ツインバード,"ツインバード","TWINBIRD CORPORATION",https://www.twinbird.jp/
ASTI株式会社,"ASTI","ASTI Corporation",https://www.asti.co.jp/
澤藤電機株式会社,"澤藤電機","SAWAFUJI ELECTRIC CO., LTD.",http://www.sawafuji.co.jp/
菊水ホールディングス株式会社,"菊水電子工業","KIKUSUI HOLDINGS CORPORATION",https://kikusui-holdings.co.jp/
千代田インテグレ株式会社,"千代田インテグレ","CHIYODA INTEGRE Corporation",http://www.chiyoda-i.co.jp/
株式会社アバールデータ,"アバールデータ","AVAL DATA CORPORATION",https://www.avaldata.co.jp/
ケル株式会社,"ケル","KEL CORPORATION",https://www.kel.jp/
岡谷電機産業株式会社,"岡谷電機産業","Okaya Electric Industries Co., Ltd.",https://www.okayaelec.co.jp/
ヘリオス　テクノ　ホールディング株式会社,"ヘリオス テクノ ホールディング","Helios Techno Holding Co., Ltd.",https://www.heliostec-hd.co.jp/index.html
日本アンテナ株式会社,"日本アンテナ","NIPPON ANTENNA Co., Ltd.",https://www.nippon-antenna.co.jp/ja/index.html
双信電機株式会社,"双信電機","Soshin Electric Co., Ltd.",http://www.soshin.co.jp/
株式会社ソフィアホールディングス,"ソフィアホールディングス","Sophia Holdings Co., Ltd.",https://www.sophia.com/
NKKスイッチズ株式会社,"NKKスイッチズ","NKK SWITCHES CO., LTD.",https://www.nkkswitches.co.jp/
日本アビオニクス株式会社,"日本アビオニクス","Nippon Avionics Co.,Ltd.",http://www.avio.co.jp/
FDK株式会社,"FDK","FDK Corporation",https://www.fdk.co.jp/
フクダ電子株式会社,"フクダ電子","FUKUDA DENSHI CO., LTD.",https://www.fukuda.co.jp/
協栄産業株式会社,"協栄産業","Kyoei Sangyo co., ltd.",https://www.kyoei.co.jp/
内海造船株式会社,"内海造船","Naikai Zosen Corporation",https://www.naikaizosen.co.jp/
サノヤスホールディングス株式会社,"サノヤスホールディングス","Sanoyas Holding Corporation",http://www.sanoyas.co.jp/
株式会社エヌ・シー・エヌ,"エヌ・シー・エヌ","New Constructor's Network Co., Ltd.",https://www.ncn-se.co.jp/
ユーピーアール株式会社,"ユーピーアール","UPR Corporation",https://www.upr-net.co.jp/
株式会社アンビスホールディングス,"アンビスホールディングス","Amvis Holdings, Inc.",https://www.amvis.com/
三菱ロジスネクスト株式会社,"三菱ロジスネクスト","Mitsubishi Logisnext Co., Ltd.",https://www.logisnext.com/
近畿車輛株式会社,"近畿車輛","THE KINKI SHARYO CO.,LTD.",https://www.kinkisharyo.co.jp/
グローバルスタイル株式会社,"グローバルスタイル","Global Style Co.,Ltd.",https://global-style.jp/corporate/
株式会社じもとホールディングス,"じもとホールディングス","Jimoto Holdings, Inc.",https://www.jimoto-hd.co.jp/
アストマックス株式会社,"アストマックス","ASTMAX Co., Ltd.",https://www.astmax.co.jp/
今村証券株式会社,"今村証券","The Imamura Securities Co.,Ltd",https://www.imamura.co.jp/
GMOフィナンシャルホールディングス株式会社,"GMOフィナンシャルホールディングス","GMO Financial Holdings, Inc.",https://www.gmofh.com/
ヒロセ通商株式会社,"ヒロセ通商","Hirose Tusyo Inc.",https://hirose-fx.co.jp/
GMB株式会社,"GMB (企業)","GMB CORPORATION",https://www.gmb.jp/
株式会社テイン,"テイン","TEIN, INC.",https://www.tein.co.jp/
株式会社エッチ・ケー・エス,"エッチ・ケー・エス","HKS Co., Ltd.",https://www.hks-power.co.jp/
東京ラヂエーター製造株式会社,"東京ラヂエーター製造","TOKYO RADIATOR MFG. Co., Ltd.",http://www.tokyo-radiator.co.jp/
株式会社ユニバンス,"ユニバンス","Univance Corporation",https://www.uvc.co.jp/
株式会社イクヨ,"イクヨ","Ikuyo Co., Ltd.",https://www.ikuyo194.co.jp/
株式会社ハイレックスコーポレーション,"ハイレックスコーポレーション","HI-LEX CORPORATION",http://www.hi-lex.co.jp/
盟和産業株式会社,"盟和産業","Meiwa Industry Co.,Ltd",http://www.meiwasangyo.co.jp/
株式会社村上開明堂,"村上開明堂","MURAKAMI CORPORATION",https://www.murakami-kaimeido.co.jp/
株式会社カーメイト,"カーメイト","CAR MATE MFG. CO., LTD.",https://www.carmate.co.jp/
八千代工業株式会社,"八千代工業","Yachiyo Industry Co.,Ltd.",https://www.yachiyo-ind.co.jp/
フジオーゼックス株式会社,"フジオーゼックス","Fuji OOZX Inc.",http://www.oozx.co.jp/
株式会社IJTT,"IJTT","IJTT Co., Ltd.",https://www.ijtt.co.jp/
インヴァスト株式会社,"インヴァスト","INV Inc.",https://www.inv.inc/
株式会社ジオコード,"ジオコード","GEOCODE, Co., Ltd.",http://www.geo-code.co.jp/
表示灯株式会社,"表示灯 (企業)","HYOJITO Co.,Ltd.",https://www.hyojito.co.jp/
株式会社アトム,"アトム (飲食業)","Atom Corporation",https://www.atom-corp.co.jp/
株式会社創健社,"創健社","Sokensha Co.,Ltd.",https://sokensha.co.jp/
はるやま商事株式会社[1],"はるやま商事","Haruyama Trading Co.,Ltd.",https://haruyama.jp/
株式会社南陽,"南陽 (福岡県)","NANYO CORPORATION",https://www.nanyo.co.jp/
初穂商事株式会社,"初穂商事","Hatsuho Shouji Co., Ltd.",http://www.hatsuho.co.jp/
株式会社山大,"山大 (宮城県)","Yamadai Corporation",http://www.yamadai.com/
株式会社オータケ,"オータケ","OTAKE CORPORATION",https://www.kk-otake.co.jp/
株式会社ナ・デックス,"ナ・デックス","NADEX CO., LTD.",https://www.nadex.co.jp/
中山福株式会社,"中山福","Nakayamafuku Co.,Ltd.",https://www.nakayamafuku.co.jp/
横浜魚類株式会社,"横浜魚類","YOKOHAMA GYORUI Co.,Ltd.",http://www.yokohamagyorui.co.jp/
ハリマ共和物産株式会社,"ハリマ共和物産","Harima-Kyowa Co., Ltd.",https://www.harimakb.co.jp/
東北化学薬品株式会社,"東北化学薬品","TOHOKU CHEMICAL Co.,LTD.",https://www.t-kagaku.co.jp/
三菱食品株式会社,"三菱食品","Mitsubishi Shokuhin Co., Ltd.",https://www.mitsubishi-shokuhin.com/
株式会社ヤギ,"ヤギ (企業)","YAGI & CO.,LTD.",https://www.yaginet.co.jp/index.html
株式会社CAPITA,"CAPITA","CAPITA Inc.",https://www.capita-inc.jp/
株式会社鳥羽洋行,"鳥羽洋行","TOBA, INC.",http://www.toba.co.jp/
スズデン株式会社,"スズデン","SUZUDEN CORPORATION",https://www.suzuden.co.jp/
尾家産業株式会社,"尾家産業","OIE SANGYO Co., Ltd.",http://www.oie.co.jp/
日新商事株式会社,"日新商事 (石油商社)","NISSIN SHOJI CO., LTD.",https://www.nissin-shoji.co.jp/
株式会社ティムコ,"ティムコ","TIEMCO Ltd.",https://www.tiemco.co.jp/
扶桑電通株式会社,"扶桑電通","FUSO DENTSU CO.,LTD.",https://www.fusodentsu.co.jp/
株式会社ハウス オブ ローゼ,"ハウス オブ ローゼ","House of Rose Co., Ltd,",https://www.houseofrose.co.jp/
株式会社ムサシ,"ムサシ (企業)","MUSASHI CO.,LTD",https://www.musashinet.co.jp/
アールビバン株式会社,"アールビバン","ART VIVANT CO.,LTD.",https://www.artvivant.net/
マルシェ株式会社,"マルシェ (企業)","MARCHE CORPORATION",https://www.marche.co.jp/corporate/
株式会社大水,"大水 (企業)","DAISUI CO.,LTD.",http://www.daisui.co.jp/
株式会社ウェッズ,"ウェッズ","WEDS CO.,LTD.",https://www.weds.co.jp/
株式会社大田花き,"大田花き","Ota Floriculture Auction Co.,Ltd.",https://otakaki.co.jp/
ジーエフシー株式会社,"ジーエフシー","GLOBAL FOOD CREATORS CO., LTD.",https://www.gfc-c.co.jp/
萬世電機株式会社,"萬世電機","MANSEI CORPORATION",http://www.mansei.co.jp/
株式会社ヤマノホールディングス,"ヤマノホールディングス","YAMANO HOLDINGS CORPORATION",http://www.yamano-hd.com/
株式会社ニチリョク,"ニチリョク","Nichiryoku Co., Ltd.",https://www.nichiryoku.co.jp/
株式会社かんなん丸,"かんなん丸","KAN-NANMARU CORPORATION",http://www.kannanmaru.co.jp/
株式会社ポプラ,"ポプラ (コンビニエンスストア)","POPLAR. CO., LTD.",https://www.poplar-cvs.co.jp/
株式会社カーチスホールディングス,"カーチスホールディングス","CARCHS Holdings Co.,Ltd.",https://www.carchs-hd.com/
株式会社エスケイジャパン,"エスケイジャパン","SK JAPAN Co., LTD.",https://www.sk-japan.co.jp/
株式会社テイツー,"テイツー","Tay Two Co., Ltd.",https://www.tay2.co.jp/
株式会社オーエムツーネットワーク,"オーエムツーネットワーク","OM2 Network Co., Ltd.",http://www.om2.co.jp/
京都きもの友禅株式会社,"京都きもの友禅","KYOTO KIMONO YUZEN CO.,LTD.",https://www.kyotokimonoyuzen.co.jp/
田中商事株式会社,"田中商事","TANAKA CO., LTD.",http://www.tanakashoji.co.jp/
株式会社うかい,"うかい","UKAI CO., LTD.",https://www.ukai.co.jp/
株式会社NaITO,"NaITO","Naito & Co.,Ltd.",https://www.naito.net/
株式会社グローバルダイニング,"グローバルダイニング","GLOBAL-DINING,INC.",https://www.global-dining.com/
株式会社星医療酸器,"星医療酸器","HOSHIIRYO-SANKI CO.,LTD.",http://www.hosi.co.jp/
株式会社NEW ART HOLDINGS,"NEW ART HOLDINGS","NEW ART HOLDINGS Co., Ltd.",https://newart-ir.jp/
株式会社トップカルチャー,"トップカルチャー","TOP CULTURE Co.，Ltd.",http://www.topculture.co.jp/
株式会社PLANT,"PLANT","PLANT Co., Ltd.",https://www.plant-co.jp/
株式会社音通,"音通","ONTSU Co.,Ltd.",https://ontsu.co.jp/
ダイコー通産株式会社,"ダイコー通産","DAIKO TSUSAN CO.,LTD.",http://daiko-tsusan.co.jp/index.html
株式会社カクヤスグループ,"カクヤス","Kakuyasu-group Co., Ltd.",https://www.kakuyasu-group.co.jp/
株式会社アースインフィニティ,"アースインフィニティ","EARTH INFINITY CO.LTD.",https://www.earth-infinity.co.jp/
株式会社アイスコ,"アイスコ","Iceco Inc.",http://www.iceco.co.jp/
ジーエルサイエンス株式会社,"ジーエルサイエンス","GL Sciences Inc.",https://www.gls.co.jp/
株式会社ナカニシ,"ナカニシ","NAKANISHI INC.",https://www.japan.nsk-dental.com/
株式会社東京衡機,"東京衡機","TOKYO KOKI CO. LTD.",https://www.tksnet.co.jp/
岡本硝子株式会社,"岡本硝子","Okamoto Glass Co., Ltd.",https://ogc-jp.com/
メディキット株式会社,"メディキット","MEDIKIT CO.,LTD.",https://www.medikit.co.jp/
IMV株式会社,"IMV","IMV Corporation",https://www.imv.co.jp/
日本精密株式会社,"日本精密","Nihon Seimitsu Co., Ltd.",http://www.nihon-s.co.jp/
株式会社KYORITSU,"共立印刷","KYORITSU  CO., LTD.",https://www.kyoritsu-hd.co.jp/
株式会社アミファ,"アミファ","Amifa Co.,Ltd.",https://www.amifa.co.jp/
プリントネット株式会社,"プリントネット","PRINTNET INC.",https://printnet.jp/
株式会社幸和製作所,"幸和製作所","KOWA CO.,LTD.",https://kowa-seisakusho.co.jp/
株式会社壽屋,"壽屋 (玩具店)","KOTOBUKIYA CO., LTD.",https://www.kotobukiya.co.jp/
東京リスマチック株式会社,"東京リスマチック","TOKYO Lithmatic Corporation",http://www.lithmatic.net/
永大産業株式会社,"永大産業","Eidai Co. Ltd.",https://www.eidai.com/
株式会社フルヤ金属,"フルヤ金属","FURUYA METAL CO.,LTD.",https://www.furuyametals.co.jp/
スターツ出版株式会社,"スターツ出版","Starts Publishing Corporation",https://starts-pub.jp/
カワセコンピュータサプライ株式会社,"カワセコンピュータサプライ","KAWASE COMPUTER SUPPLIES CO.,LTD.",https://www.kc-s.co.jp/
株式会社アルメディオ,"アルメディオ","Almedio Inc.",https://www.almedio.co.jp/
ピープル株式会社,"ピープル (玩具メーカー)","People Co., Ltd.",https://www.people-kk.co.jp/
エステールホールディングス株式会社,"As-meエステール","ESTELLE HOLDINGS Co., Ltd.",https://www.estelle.co.jp/
竹田印刷株式会社,"竹田印刷","TAKEDA PRINTING CO.,LTD.[1]",https://www.takeda-prn.co.jp/
株式会社光・彩,"光・彩","Kohsai Co.,Ltd.",https://www.kohsai-qq.co.jp/
株式会社ノダ,"ノダ","Noda Corporation",http://www.noda-co.jp/
サンメッセ株式会社,"サンメッセ","Sun Messe Co., Ltd.",https://www.sunmesse.co.jp/
タカノ株式会社,"タカノ (家具)","Takano Company Limited",https://www.takano-net.co.jp/
南海プライウッド株式会社,"南海プライウッド","Nankai Plywood Company, Limited",https://www.nankaiplywood.co.jp/
セブン工業株式会社,"セブン工業","Seven Industries Co., Ltd.",https://www.seven-gr.co.jp/
ホクシン株式会社,"ホクシン","Hokushin Co.,Ltd",https://www.hokushinmdf.jp/
MICS化学株式会社,"MICS化学","MICS Chemical Co., Ltd.",https://www.c-mics.com/
株式会社マツモト,"マツモト (福岡県)","Matsumoto Inc.",https://www.matsumoto-inc.co.jp/
ヨネックス株式会社,"ヨネックス","YONEX Co., Ltd.",https://www.yonex.co.jp/
光村印刷株式会社,"光村印刷","MITSUMURA PRINTING Co., Ltd.",https://www.mitsumura.co.jp/
旭化学工業株式会社,"旭化学工業","ASAHI KAGAKU KOGYO Co., Ltd.",http://www.asahikagakukogyo.co.jp/
株式会社ニッピ,"ニッピ","Nippi,Incorporated",https://www.nippi-inc.co.jp/default.aspx
株式会社ツツミ,"ツツミ","TSUTSUMI JEWELRY CO.,LTD.",https://www.tsutsumi.co.jp/
株式会社リーガルコーポレーション,"リーガルコーポレーション","REGAL CORPORATION",https://www.regal.co.jp/
菊水化学工業株式会社,"菊水化学工業","KIKUSUI Chemical Industries Co., Ltd.",https://www.kikusui-chem.co.jp/
兼松サステック株式会社,"兼松サステック","Kanematsu Sustech Corporation",http://www.ksustech.co.jp/
興研株式会社,"興研","Koken Ltd.",http://www.koken-ltd.co.jp/
株式会社リヒトラブ,"リヒトラブ","LIHIT LAB.,INC.",https://www.lihit-lab.com/
株式会社重松製作所,"重松製作所","SHIGEMATSU WORKS CO.,LTD.",http://www.sts-japan.com/
ネポン株式会社,"ネポン","Nepon Inc.",https://www.nepon.co.jp/
セーラー万年筆株式会社,"セーラー万年筆","The Sailor Pen Co.,Ltd.",https://www.sailor.co.jp/
ユアサ・フナショク株式会社,"ユアサ・フナショク","YUASA FUNASHOKU CO., LTD.",https://www.yuasa-funashoku.com/
三共生興株式会社,"三共生興","SANKYO SEIKO CO.,LTD.",http://www.sankyoseiko.co.jp/
大興電子通信株式会社,"大興電子通信","DAIKO DENSHI TSUSHIN, LTD.",https://www.daikodenshi.jp/
株式会社ルックホールディングス,"ルック (アパレル)","LOOK HOLDINGS INC.",https://www.look-holdings.jp/
中央魚類株式会社,"中央魚類","Chuo Gyorui Co., Ltd.",http://www.marunaka-net.co.jp/
東都水産株式会社,"東都水産","TOHTO SUISAN CO.,LTD.",http://www.tohsui.co.jp/
築地魚市場株式会社,"築地魚市場","TSUKIJI UOICHIBA COMPANY,LIMITED",http://www.tsukiji-uoichiba.co.jp/
株式会社東京ソワール,"東京ソワール","Tokyo Soir Co.,Ltd.",https://www.soir.co.jp/
OUGホールディングス株式会社,"OUGホールディングス","OUG Holdings Inc.",https://www.oug.co.jp/
横浜丸魚株式会社,"横浜丸魚","Yokohama maruuo Co.,Ltd.",https://www.yokohama-maruuo.co.jp/
三谷商事株式会社,"三谷商事","MITANI CORPORATION",https://www.mitani-corp.co.jp/
ナラサキ産業株式会社,"ナラサキ産業","NARASAKISANGYOCO.,LTD.",http://www.narasaki.co.jp/
ナイス株式会社,"ナイス (神奈川県の企業)","Nice Corporation",https://www.nice.co.jp/
クワザワホールディングス株式会社,"クワザワホールディングス","KUWAZAWA Holdings Corporation",https://www.kuwazawa-hd.co.jp/
堀田丸正株式会社,"堀田丸正","Marusho Hotta Co., Ltd.",https://www.hotta-marusho.co.jp/
株式会社キムラタン,"キムラタン","Kimuratan Corporation",https://www.kimuratan.co.jp/
