株式会社極洋,"極洋","KYOKUYO CO., LTD.",https://www.kyokuyo.co.jp/
藤森工業株式会社,"藤森工業","Fujimori Kogyo Co., Ltd.",https://www.zacros.co.jp/
株式会社ヴィア・ホールディングス,"ヴィア・ホールディングス","VIA Holdings,Inc.",https://www.via-hd.co.jp/
株式会社TAKARA & COMPANY,"宝印刷","TAKARA & COMPANY LTD.",https://www.takara-company.co.jp/
前澤化成工業株式会社,"前澤化成工業","MAEZAWA KASEI INDUSTRIES CO., LTD.",https://www.maezawa-k.co.jp/
未来工業株式会社,"未来工業","MIRAI INDUSTRY CO.,LTD.",https://www.mirai.co.jp/
株式会社アシックス,"アシックス","ASICS Corporation",https://www.asics.com/
株式会社JSP,"JSP (企業)","JSP Corporation",https://www.co-jsp.co.jp/
ニチハ株式会社,"ニチハ","NICHIHA CORPORATION",https://www.nichiha.co.jp/
ローランド株式会社,"ローランド","Roland Corporation",https://www.roland.com/jp/
株式会社エフピコ,"エフピコ","FP CORPORATION",https://www.fpco.jp/
小松ウオール工業株式会社,"小松ウオール工業","KOMATSU WALL INDUSTRY CO.,LTD.",https://www.komatsuwall.co.jp/
ヤマハ株式会社,"ヤマハ","YAMAHA CORPORATION",https://jp.yamaha.com/
クリナップ株式会社,"クリナップ","Cleanup Corporation",https://cleanup.jp/
ピジョン株式会社,"ピジョン (企業)","Pigeon Corporation",https://www.pigeon.co.jp/
天馬株式会社,"天馬 (企業)","TENMA CORPORATION",https://www.tenmacorp.co.jp/
株式会社キングジム,"キングジム","KING JIM CO., LTD.",https://www.kingjim.co.jp/
リンテック株式会社,"リンテック","LINTEC Corporation",https://www.lintec.co.jp/
東リ株式会社,"東リ","TOLI Corporation",https://www.toli.co.jp/
株式会社イトーキ,"イトーキ","ITOKI CORPORATION",https://www.itoki.jp/
三菱鉛筆株式会社,"三菱鉛筆","MITSUBISHI PENCIL COMPANY,LIMITED",https://www.mpuni.co.jp/
タカラスタンダード株式会社,"タカラスタンダード","TAKARA STANDARD CO.,LTD.",https://www.takara-standard.co.jp/
ナカバヤシ株式会社,"ナカバヤシ","NAKABAYASHI CO.,LTD.",https://www.nakabayashi.co.jp/
株式会社ニフコ,"ニフコ","NIFCO INC.",https://www.nifco.com/
立川ブラインド工業株式会社,"立川ブラインド工業","TACHIKAWA CORPORATION",https://www.blind.co.jp/
グローブライド株式会社,"グローブライド","Globeride, Inc.",http://www.globeride.co.jp/
株式会社オカムラ,"オカムラ","OKAMURA CORPORATION",https://www.okamura.co.jp/
株式会社バルカー,"バルカー (企業)","VALQUA, LTD.",http://www.valqua.co.jp/
伊藤忠商事株式会社,"伊藤忠商事","ITOCHU Corporation",https://www.itochu.co.jp/ja/
丸紅株式会社,"丸紅","Marubeni Corporation",https://www.marubeni.com/jp/
高島株式会社,"高島 (商社)","Takashima & Co.,Ltd.",https://www.tak.co.jp/
株式会社ヨンドシーホールディングス,"ヨンドシーホールディングス","YONDOSHI HOLDINGS INC.",https://yondoshi.co.jp/
株式会社三陽商会,"三陽商会","SANYO SHOKAI Ltd.",https://www.sanyo-shokai.co.jp/
長瀬産業株式会社,"長瀬産業","NAGASE & CO., LTD.",https://www.nagase.co.jp/
蝶理株式会社,"蝶理","Chori Co., LTD.",https://www.chori.co.jp/
株式会社オンワードホールディングス,"オンワードホールディングス","ONWARD HOLDINGS Co., Ltd.",https://www.onward-hd.co.jp/
美津濃株式会社,"ミズノ","Mizuno Corporation",https://corp.mizuno.com/jp/
日本紙パルプ商事株式会社,"日本紙パルプ商事","Japan Pulp and Paper Company Limited",https://www.kamipa.co.jp/
東京エレクトロン株式会社,"東京エレクトロン","Tokyo Electron Limited",https://www.tel.co.jp/
カメイ株式会社,"カメイ","KAMEI CORPORATION",https://www.kamei.co.jp/
スターゼン株式会社,"スターゼン","Starzen Co.,Ltd",https://www.starzen.co.jp/
セイコーグループ株式会社,"セイコーグループ","SEIKO GROUP CORPORATION",https://www.seiko.co.jp/
椿本興業株式会社,"椿本興業","TSUBAKIMOTO KOGYO CO.,LTD.",http://www.tsubaki.co.jp/
住友商事株式会社,"住友商事","Sumitomo Corporation",https://www.sumitomocorp.com/ja/jp
BIPROGY株式会社,"BIPROGY","BIPROGY Inc.",https://www.biprogy.com/
株式会社内田洋行,"内田洋行","UCHIDA YOKO CO., LTD.",https://www.uchida.co.jp/
三菱商事株式会社,"三菱商事","Mitsubishi Corporation",https://www.mitsubishicorp.com/jp/ja/
第一実業株式会社,"第一実業","DAIICHI JITSUGYO CO., LTD.",https://www.djk.co.jp/
キヤノンマーケティングジャパン株式会社,"キヤノンマーケティングジャパン","Canon Marketing Japan Inc.",https://cweb.canon.jp/corporate/
西華産業株式会社,"西華産業","SEIKA CORPORATION",https://www.seika.com/
佐藤商事株式会社,"佐藤商事","Sato Shoji Corporation",https://www.satoshoji.co.jp/
東京産業株式会社,"東京産業","TOKYO SANGYO CO.,LTD.",https://www.tscom.co.jp/
ユアサ商事株式会社,"ユアサ商事","YUASA TRADING CO.,LTD.",https://www.yuasa.co.jp/
トルク株式会社,"トルク (企業)","TORQ Inc.",https://www.torq.co.jp/
阪和興業株式会社,"阪和興業","Hanwa Co.,Ltd.",https://www.hanwa.co.jp/
正栄食品工業株式会社,"正栄食品工業","SHOEI FOODS CORPORATION",http://www.shoeifoods.co.jp/
株式会社カナデン,"カナデン","KANADEN CORPORATION",https://www.kanaden.co.jp/
岩谷産業株式会社,"岩谷産業","Iwatani Corporation",http://www.iwatani.co.jp/jpn/
ニチモウ株式会社,"ニチモウ","NICHIMO CO.,LTD.",https://www.nichimo.co.jp/
アステナホールディングス株式会社,"アステナホールディングス","Astena Holdings Co., Ltd.",https://www.astena-hd.com/
兼松エレクトロニクス株式会社,"兼松エレクトロニクス","KANEMATSU ELECTRONICS LTD.",https://www.kel.co.jp/
三愛オブリ株式会社,"三愛オブリ","SAN-AI OBBLI CO., LTD.",https://www.san-ai-obbli.com/
稲畑産業株式会社,"稲畑産業","Inabata & Co.,Ltd.",https://www.inabata.co.jp/
株式会社GSIクレオス,"GSIクレオス","GSI Creos Corporation",https://www.gsi.co.jp/
明和産業株式会社,"明和産業","Meiwa Corporation",https://www.meiwa.co.jp/
株式会社ゴールドウイン,"ゴールドウイン","GOLDWIN INC.",https://www.goldwin.co.jp/
株式会社ワキタ,"ワキタ","Wakita & Co., LTD.",http://www.wakita.co.jp/
東邦ホールディングス株式会社,"東邦ホールディングス","TOHO HOLDINGS Co.,Ltd",https://www.tohohd.co.jp/
株式会社サンゲツ,"サンゲツ","Sangetsu Corporation",https://www.sangetsu.co.jp/
シナネンホールディングス株式会社,"シナネンホールディングス","SINANEN HOLDINGS CO., LTD.",https://www.sinanengroup.co.jp/
伊藤忠エネクス株式会社,"伊藤忠エネクス","ITOCHU ENEX CO.,LTD.",https://www.itcenex.com/
新光商事株式会社,"新光商事","Shinko Shoji Co.,Ltd.",https://www.shinko-sj.co.jp/
株式会社東陽テクニカ,"東陽テクニカ","TOYO Corporation",https://www.toyo.co.jp/
株式会社モスフードサービス[1],"モスバーガー","MOS FOOD SERVICES, INC.",https://www.mos.jp/
都築電気株式会社,"都築電気","TSUZUKI DENKI CO.,LTD.",https://www.tsuzuki.co.jp/
ソーダニッカ株式会社,"ソーダニッカ","Soda Nikka Co., Ltd.",http://www.sodanikka.co.jp/
株式会社立花エレテック,"立花エレテック","TACHIBANA ELETECH CO., LTD.",http://www.tachibana.co.jp/
株式会社木曽路,"木曽路 (企業)","KISOJI CO.,LTD.",https://www.kisoji.co.jp/
SRSホールディングス株式会社,"SRSホールディングス","SRS HOLDINGS CO., LTD.",https://srs-holdings.co.jp/
株式会社千趣会,"千趣会","SENSHUKAI CO.,LTD.",https://www.senshukai.co.jp/
株式会社リテールパートナーズ,"リテールパートナーズ","RETAIL PARTNERS CO., LTD.",http://retailpartners.co.jp/
株式会社ケーヨー,"ケーヨー","Keiyo Co., Ltd.",https://www.keiyo.co.jp/
上新電機株式会社,"上新電機","Joshin Denki Co.,Ltd.",https://www.joshin.co.jp/
日本瓦斯株式会社,"日本瓦斯","NIPPON GAS CO., LTD.",https://www.nichigas.co.jp/
株式会社いなげや,"いなげや","Inageya Co., Ltd.",https://www.inageya.co.jp/
株式会社チヨダ,"チヨダ","CHIYODA CO.,LTD.",https://www.chiyodagrp.co.jp/
株式会社ライフコーポレーション,"ライフコーポレーション","LIFE CORPORATION",http://www.lifecorp.jp/
株式会社リンガーハット,"リンガーハット","RINGER HUT CO.,LTD.",https://www.ringerhut.co.jp/
株式会社ミスターマックス・ホールディングス,"ミスターマックス・ホールディングス","MrMax Holdings Ltd.",https://www.mrmax.co.jp/corporation/
株式会社AOKIホールディングス,"AOKIホールディングス","AOKI Holdings Inc.",https://www.aoki-hd.co.jp/
株式会社オークワ,"オークワ","OKUWA CO.,LTD.",https://www.okuwa.net/
株式会社コメリ[1],"コメリ","KOMERI Co., Ltd.",https://www.komeri.bit.or.jp/
青山商事株式会社[1],"青山商事","AOYAMA TRADING Co., Ltd.",https://www.aoyama-syouji.co.jp/
株式会社松屋,"松屋 (百貨店)","MATSUYA CO.,LTD.",https://www.matsuya.com/
エイチ・ツー・オー リテイリング株式会社,"エイチ・ツー・オー リテイリング","H2O Retailing Corporation",https://www.h2o-retailing.co.jp/
株式会社丸井グループ,"丸井グループ","MARUI GROUP CO., LTD.",https://www.0101maruigroup.co.jp/
株式会社クレディセゾン,"クレディセゾン","Credit Saison Co., Ltd.",https://www.saisoncard.co.jp/
アクシアルリテイリング株式会社,"アクシアル リテイリング","Axial Retailing Inc.",https://www.axial-r.com/
株式会社イズミ,"イズミ","IZUMI Co.,Ltd.",https://www.izumi.co.jp/
株式会社フォーバル,"フォーバル","FORVAL CORPORATION",https://www.forval.co.jp/
株式会社フジ・リテイリング,"フジ・リテイリング","FUJI RETAILING CO.,LTD.",https://www.the-fuji.com/
ゼビオホールディングス株式会社,"ゼビオホールディングス","XEBIO HOLDINGS CO., LTD.",http://www.xebio.co.jp/
日産東京販売ホールディングス株式会社,"日産東京販売ホールディングス","Nissan Tokyo Sales Holdings Co., Ltd.",https://www.nissan-tokyo-hd.co.jp/index.html
株式会社あおぞら銀行,"あおぞら銀行","Aozora Bank, Ltd.",https://www.aozorabank.co.jp/
株式会社三菱UFJフィナンシャル・グループ,"三菱UFJフィナンシャル・グループ","Mitsubishi UFJ Financial Group, Inc.",https://www.mufg.jp/
株式会社りそなホールディングス,"りそなホールディングス","Resona Holdings, Inc.",https://www.resona-gr.co.jp/
株式会社千葉銀行,"千葉銀行","The Chiba Bank, Ltd.",https://www.chibabank.co.jp/
株式会社群馬銀行,"群馬銀行","The Gunma Bank, Ltd.",https://www.gunmabank.co.jp/
株式会社武蔵野銀行,"武蔵野銀行","The Musashino Bank, Ltd.",https://www.musashinobank.co.jp/
株式会社筑波銀行,"筑波銀行","Tsukuba Bank, Ltd.",https://www.tsukubabank.co.jp/
株式会社山形銀行,"山形銀行","The Yamagata Bank,Ltd.",https://www.yamagatabank.co.jp/
株式会社東邦銀行,"東邦銀行","The Toho Bank,Ltd.",https://www.tohobank.co.jp/
株式会社ふくおかフィナンシャルグループ,"ふくおかフィナンシャルグループ","Fukuoka Financial Group, Inc.",https://www.fukuoka-fg.com/
スルガ銀行株式会社,"スルガ銀行","Suruga Bank Ltd.",https://www.surugabank.co.jp/surugabank/
株式会社八十二銀行,"八十二銀行","The Hachijuni Bank,Ltd.",https://www.82bank.co.jp/
株式会社大垣共立銀行,"大垣共立銀行","The Ogaki Kyoritsu Bank, Ltd.",https://www.okb.co.jp/
株式会社福井銀行,"福井銀行","The Fukui Bank, Ltd.",https://www.fukuibank.co.jp/
株式会社清水銀行,"清水銀行","THE SHIMIZU BANK,LTD.",https://www.shimizubank.co.jp/
株式会社滋賀銀行,"滋賀銀行","THE SHIGA BANK,LTD.",https://www.shigagin.com/
株式会社南都銀行,"南都銀行","The Nanto Bank, Ltd.",https://www.nantobank.co.jp/
株式会社百五銀行,"百五銀行","The Hyakugo Bank,Ltd.",https://www.hyakugo.co.jp/
株式会社京都銀行,"京都銀行","The Bank of Kyoto, Ltd.",https://www.kyotobank.co.jp/
株式会社紀陽銀行,"紀陽銀行","The Kiyo Bank, Ltd.",https://www.kiyobank.co.jp/
株式会社ほくほくフィナンシャルグループ,"ほくほくフィナンシャルグループ","Hokuhoku Financial Group, Inc.",https://www.hokuhoku-fg.co.jp/
株式会社山陰合同銀行,"山陰合同銀行","The San-in Godo Bank,Ltd.",https://www.gogin.co.jp/
株式会社百十四銀行,"百十四銀行","The Hyakujushi Bank, Ltd.",https://www.114bank.co.jp/
株式会社四国銀行,"四国銀行","The Shikoku Bank, Ltd.",https://www.shikokubank.co.jp/
株式会社大分銀行,"大分銀行","THE OITA BANK,LTD.",https://www.oitabank.co.jp/
株式会社宮崎銀行,"宮崎銀行","The Miyazaki Bank Ltd.",https://www.miyagin.co.jp/
株式会社佐賀銀行,"佐賀銀行","THE BANK OF SAGA LTD.",https://www.sagabank.co.jp/
株式会社琉球銀行,"琉球銀行","Bank of The Ryukyus, Limited",https://www.ryugin.co.jp/
株式会社セブン銀行,"セブン銀行","Seven Bank, Ltd.",https://www.sevenbank.co.jp/
株式会社みずほフィナンシャルグループ,"みずほフィナンシャルグループ","Mizuho Financial Group, Inc.",https://www.mizuho-fg.co.jp/
株式会社山口フィナンシャルグループ,"山口フィナンシャルグループ","Yamaguchi Financial Group, Inc.",https://www.ymfg.co.jp/
芙蓉総合リース株式会社,"芙蓉総合リース","Fuyo General Lease Co., Ltd.",https://www.fgl.co.jp/index.html
みずほリース株式会社,"みずほリース","Mizuho Leasing Company, Limited",https://www.mizuho-ls.co.jp/
東京センチュリー株式会社,"東京センチュリー","Tokyo Century Corporation",https://www.tokyocentury.co.jp/jp/
SBIホールディングス株式会社,"SBIホールディングス","SBI Holdings, Inc.",https://www.sbigroup.co.jp/
日本証券金融株式会社,"日本証券金融","JAPAN SECURITIES FINANCE CO., LTD.",https://www.jsf.co.jp/
株式会社名古屋銀行,"名古屋銀行","The Bank of Nagoya, Ltd.",https://www.meigin.com/
株式会社愛媛銀行,"愛媛銀行","The Ehime Bank, Ltd.",https://www.himegin.co.jp/
株式会社京葉銀行,"京葉銀行","The Keiyo Bank, Ltd.",https://www.keiyobank.co.jp/
株式会社栃木銀行,"栃木銀行","THE TOCHIGI BANK,LTD.",https://www.tochigibank.co.jp/
株式会社東和銀行,"東和銀行","THE TOWA BANK,LTD.",https://www.towabank.co.jp/
イオンフィナンシャルサービス株式会社,"イオンフィナンシャルサービス","AEON Financial Service Co., Ltd.",https://www.aeonfinancial.co.jp/
オリックス株式会社,"オリックス (企業)","ORIX Corporation",https://www.orix.co.jp/
トモニホールディングス株式会社,"トモニホールディングス","TOMONY Holdings, Inc.",https://www.tomony-hd.co.jp/
株式会社大和証券グループ本社,"大和証券グループ本社","Daiwa Securities Group Inc.",https://www.daiwa-grp.jp/
野村ホールディングス株式会社,"野村ホールディングス","Nomura Holdings, Inc.",https://www.nomuraholdings.com/jp/top.html
株式会社岡三証券グループ,"岡三証券グループ","OKASAN SECURITIES GROUP INC.",https://www.okasan.jp/
丸三証券株式会社,"丸三証券","Marusan Securities Co., Ltd.",https://www.marusan-sec.co.jp/
東海東京フィナンシャル・ホールディングス株式会社,"東海東京フィナンシャル・ホールディングス","Tokai Tokyo Financial Holdings, Inc．",https://www.tokaitokyo-fh.jp/
水戸証券株式会社,"水戸証券","Mito Securities Co.,Ltd.",https://www.mito.co.jp/
松井証券株式会社,"松井証券","Matsui Securities Co., Ltd.",https://www.matsui.co.jp/
SOMPOホールディングス株式会社,"SOMPOホールディングス","Sompo Holdings, Inc.",https://www.sompo-hd.com/
株式会社日本取引所グループ,"日本取引所グループ","Japan Exchange Group, Inc.",https://www.jpx.co.jp/
岩井コスモホールディングス株式会社,"岩井コスモホールディングス","IwaiCosmo Holdings, Inc.",http://www.iwaicosmo-hd.jp/
アイザワ証券グループ株式会社,"アイザワ証券グループ","AIZAWA SECURITIES GROUP CO., LTD.",https://www.aizawa-group.jp/
フィデアホールディングス株式会社,"フィデアホールディングス","FIDEA Holdings Co., Ltd.",http://www.fidea.co.jp/
MS&ADインシュアランスグループホールディングス株式会社,"MS&ADインシュアランスグループホールディングス","MS&AD Insurance Group Holdings, Inc.",https://www.ms-ad-hd.com/
株式会社マネーパートナーズグループ,"マネーパートナーズグループ","MONEY PARTNERS GROUP CO.,LTD.",https://www.moneypartners-group.co.jp/
第一生命ホールディングス株式会社,"第一生命ホールディングス","Dai-ichi Life Holdings, Inc.",https://www.dai-ichi-life-hd.com/
東京海上ホールディングス株式会社,"東京海上ホールディングス","Tokio Marine Holdings, Inc.[1]",https://www.tokiomarinehd.com/
株式会社アドバンテッジリスクマネジメント,"アドバンテッジリスクマネジメント","Advantage Risk Management Co., Ltd.",https://www.armg.jp/
イー・ギャランティ株式会社,"イー・ギャランティ","eGuarantee,Inc",https://www.eguarantee.co.jp/
NECキャピタルソリューション株式会社,"NECキャピタルソリューション","NEC Capital Solutions Limited",https://www.necap.co.jp/
株式会社T&Dホールディングス,"T&Dホールディングス","T&D Holdings, Inc.",https://www.td-holdings.co.jp/
株式会社アドバンスクリエイト,"アドバンスクリエイト","Advance Create Co., Ltd.",https://www.advancecreate.co.jp/
平和不動産株式会社,"平和不動産","HEIWA REAL ESTATE CO.,LTD.",https://www.heiwa-net.co.jp/
東京建物株式会社,"東京建物","Tokyo Tatemono Co., Ltd.",https://www.tatemono.com/
京阪神ビルディング株式会社,"京阪神ビルディング","Keihanshin Building Co., Ltd.",https://www.keihanshin.co.jp/
住友不動産株式会社,"住友不動産","Sumitomo Realty & Development Co., Ltd.",https://www.sumitomo-rd.co.jp/
株式会社東京楽天地,"東京楽天地","TOKYO RAKUTENCHI CO.,LTD.",https://www.rakutenchi.co.jp/
スターツコーポレーション株式会社,"スターツコーポレーション","Starts Corporation Inc.",https://www.starts.co.jp/
フジ住宅株式会社,"フジ住宅","FUJI CORPORATION LIMITED",https://www.fuji-jutaku.co.jp/
空港施設株式会社,"空港施設 (企業)","AIRPORT FACILITIES CO.,LTD.",http://www.afc.jp/
明和地所株式会社,"明和地所","Meiwa Estate Company Limited",https://www.meiwajisyo.co.jp/
株式会社ゴールドクレスト,"ゴールドクレスト (不動産業)","Goldcrest Co.,Ltd",https://www.goldcrest.co.jp/
株式会社リログループ,"リログループ","Relo Group, Inc.",https://www.relo.jp/
株式会社日神グループホールディングス,"日神グループホールディングス","NISSHIN GROUP HOLDINGS Company,Limited",https://www.nisshinfudosan.co.jp/
株式会社日本エスコン,"日本エスコン","ES-CON JAPAN Ltd.",https://www.es-conjapan.co.jp/
MIRARTHホールディングス株式会社,"タカラレーベン","MIRARTH HOLDINGS, Inc.",https://mirarth.co.jp/
株式会社AVANTIA,"AVANTIA","AVANTIA CO., LTD.",https://avantia-g.co.jp/
ファースト住建株式会社,"ファースト住建","First Juken Co., Ltd.",https://www.f-juken.co.jp/
トーセイ株式会社,"トーセイ","TOSEI CO., LTD.",https://www.toseicorp.co.jp/
サンフロンティア不動産株式会社,"サンフロンティア不動産","Sun Frontier Fudousan Co., Ltd.",https://www.sunfrt.co.jp/
株式会社FJネクストホールディングス,"FJネクストホールディングス","FJ NEXT HOLDINGS CO.,LTD.",https://www.fjnext-hd.co.jp/
グランディハウス株式会社,"グランディハウス","Grandy House Corporation",https://www.grandy.co.jp/
東武鉄道株式会社,"東武鉄道","TOBU RAILWAY CO., LTD.",https://www.tobu.co.jp/
京浜急行電鉄株式会社,"京浜急行電鉄","Keikyu Corporation",https://www.keikyu.co.jp/
小田急電鉄株式会社,"小田急電鉄","Odakyu Electric Railway Co., Ltd.[1]",https://www.odakyu.jp/
京王電鉄株式会社,"京王電鉄","Keio Corporation",https://www.keio.co.jp/
京成電鉄株式会社,"京成電鉄","Keisei Electric Railway Co., Ltd.",https://www.keisei.co.jp/
富士急行株式会社,"富士急行","FUJI KYUKO CO.,LTD.",https://www.fujikyu.co.jp/
東日本旅客鉄道株式会社,"東日本旅客鉄道","East Japan Railway Company",https://www.jreast.co.jp/
西日本旅客鉄道株式会社,"西日本旅客鉄道","West Japan Railway Company",https://www.westjr.co.jp/
東海旅客鉄道株式会社,"東海旅客鉄道","Central Japan Railway Company",https://jr-central.co.jp/
鴻池運輸株式会社,"鴻池運輸","Konoike Transport Co., Ltd.",https://www.konoike.net/
西日本鉄道株式会社,"西日本鉄道","Nishi-Nippon Railroad Co., Ltd.",https://www.nishitetsu.co.jp/
近鉄グループホールディングス株式会社,"近鉄グループホールディングス","Kintetsu Group Holdings Co.,Ltd.",https://www.kintetsu-g-hd.co.jp/
阪急阪神ホールディングス株式会社,"阪急阪神ホールディングス","Hankyu Hanshin Holdings, Inc.",https://www.hankyu-hanshin.co.jp/
南海電気鉄道株式会社,"南海電気鉄道","Nankai Electric Railway Co., Ltd.",https://www.nankai.co.jp/
京阪ホールディングス株式会社,"京阪ホールディングス","Keihan Holdings Co.,Ltd.",https://www.keihan-holdings.co.jp/
神戸電鉄株式会社,"神戸電鉄","Kobe Electric Railway Co.,Ltd.",https://www.shintetsu.co.jp/
名古屋鉄道株式会社,"名古屋鉄道","Nagoya Railroad Co.,Ltd.",https://top.meitetsu.co.jp/
山陽電気鉄道株式会社,"山陽電気鉄道","Sanyo Electric Railway Co., Ltd.",https://www.sanyo-railway.co.jp/index.html
株式会社アルプス物流,"アルプス物流","ALPS LOGISTICS CO.,LTD.",https://www.alps-logistics.com/
トランコム株式会社,"トランコム","TRANCOM Co., Ltd.",https://www.trancom.co.jp/
山九株式会社,"山九","SANKYU INC.",https://www.sankyu.co.jp/
株式会社日新,"日新","NISSIN CORPORATION",https://www.nissin-tw.com/
丸全昭和運輸株式会社,"丸全昭和運輸","Maruzen Showa Unyu Co.,Ltd.",https://www.maruzenshowa.co.jp/
ニッコンホールディングス株式会社,"日本梱包運輸倉庫","NIKKON Holdings Co., Ltd.",http://www.nikkon-hd.co.jp/
神奈川中央交通株式会社,"神奈川中央交通","Kanagawa Chuo Kotsu Co.,Ltd.",https://www.kanachu.co.jp/
AZ-COM丸和ホールディングス株式会社,"丸和運輸機関","AZ-COM MARUWA Holdings Inc.",https://www.az-com-maruwa-hd.co.jp/
株式会社C&Fロジホールディングス,"C&Fロジホールディングス","Chilled & Frozen Logistics Holdings Co., Ltd.",https://www.cflogi.co.jp/
川崎汽船株式会社,"川崎汽船","Kawasaki Kisen Kaisha, Ltd.",https://www.kline.co.jp/
NSユナイテッド海運株式会社,"NSユナイテッド海運","NS UNITED KAIUN KAISHA, LTD.",http://www.nsuship.co.jp/
飯野海運株式会社,"飯野海運","IINO KAIUN KAISHA, LTD.",https://www.iino.co.jp/
九州旅客鉄道株式会社,"九州旅客鉄道","Kyushu Railway Company",https://www.jrkyushu.co.jp/
NIPPON EXPRESSホールディングス株式会社,"NIPPON EXPRESSホールディングス","NIPPON EXPRESS HOLDINGS, INC.",https://www.nipponexpress-holdings.com/
ビーウィズ株式会社,"ビーウィズ","Bewith, Inc.",http://www.bewith.net/
Genky DrugStores株式会社,"ゲンキー","Genky DrugStores Co., Ltd.",http://www.genky.co.jp/
KPPグループホールディングス株式会社,"KPPグループホールディングス","KPP GROUP HOLDINGS CO., LTD.",https://www.kpp-gr.com/ja/index.html
ブックオフグループホールディングス株式会社,"ブックオフコーポレーション","BOOKOFF GROUP HOLDINGS LIMITED",https://www.bookoffgroup.co.jp/
株式会社ギフトホールディングス,"ギフト (企業)","GIFT HOLDINGS INC.",https://www.gift-group.co.jp/
三菱倉庫株式会社,"三菱倉庫","Mitsubishi Logistics Corporation",https://www.mitsubishi-logistics.co.jp/
三井倉庫ホールディングス株式会社,"三井倉庫ホールディングス","MITSUI−SOKO HOLDINGS Co.,Ltd.",https://msh.mitsui-soko.com/
株式会社住友倉庫,"住友倉庫","The Sumitomo Warehouse Co., Ltd.",https://www.sumitomo-soko.co.jp/
澁澤倉庫株式会社,"澁澤倉庫","The Shibusawa Warehouse Co., Ltd.",https://www.shibusawa.co.jp/
株式会社ヤマタネ,"ヤマタネ","Yamatane Corporation",https://www.yamatane.co.jp/
日本トランスシティ株式会社,"日本トランスシティ","Japan Transcity Corporation",https://www.trancy.co.jp/
安田倉庫株式会社,"安田倉庫","Yasuda Logistics Corporation",http://www.yasuda-soko.co.jp/
大栄環境株式会社,"大栄環境グループ","Daiei Kankyo Co.,Ltd.",https://www.dinsgr.co.jp/
東洋埠頭株式会社,"東洋埠頭","TOYO WHARF & WAREHOUSE CO.,LTD.",https://www.toyofuto.co.jp/
株式会社上組,"上組","Kamigumi Co.,Ltd.",https://www.kamigumi.co.jp/
内外トランスライン株式会社,"内外トランスライン","NAIGAI TRANS LINE LTD.",https://www.ntl-naigai.co.jp/index.html
